{
  "$schema": "https://json-schema.org/draft/2020-12/schema",
  "$id": "https://dobrokek.local/schemas/pack-schema.json",
  "title": "Dobrokek quiz pack",
  "type": "object",
  "additionalProperties": false,
  "required": ["schema_version", "pack_id", "title", "created_at", "authors", "questions"],
  "properties": {
    "schema_version": {"const": 1},
    "pack_id": {"type": "string", "format": "uuid"},
    "title": {"type": "string", "minLength": 1, "maxLength": 120},
    "created_at": {"type": "string", "format": "date-time"},
    "authors": {
      "type": "array",
      "minItems": 2,
      "maxItems": 30,
      "items": {
        "type": "object",
        "additionalProperties": false,
        "required": ["id", "display_name"],
        "properties": {
          "id": {"type": "string", "pattern": "^[a-z0-9][a-z0-9_-]{0,63}$"},
          "display_name": {"type": "string", "minLength": 1, "maxLength": 64}
        }
      }
    },
    "questions": {
      "type": "array",
      "minItems": 1,
      "maxItems": 50,
      "items": {
        "type": "object",
        "additionalProperties": false,
        "required": [
          "id", "position", "telegram_chat_id", "telegram_message_id", "author_id",
          "media_path", "sha256", "duration_ms", "size_bytes"
        ],
        "properties": {
          "id": {"type": "string", "format": "uuid"},
          "position": {"type": "integer", "minimum": 1},
          "telegram_chat_id": {"type": "integer"},
          "telegram_message_id": {"type": "integer", "minimum": 1},
          "author_id": {"type": "string", "pattern": "^[a-z0-9][a-z0-9_-]{0,63}$"},
          "media_path": {
            "type": "string",
            "pattern": "^videos/[0-9a-f]{8}-[0-9a-f]{4}-4[0-9a-f]{3}-[89ab][0-9a-f]{3}-[0-9a-f]{12}\\.mp4$"
          },
          "sha256": {"type": "string", "pattern": "^[0-9a-f]{64}$"},
          "duration_ms": {"type": "integer", "minimum": 1, "maximum": 3600000},
          "size_bytes": {"type": "integer", "minimum": 1}
        }
      }
    }
  }
}
